{
  "agent": "codex",
  "chorus_output_version": 1,
  "content": "Running a shell command.\n[TOOL: shell]\n{\"command\":\"ls /workspace/demo\"}\n[/TOOL]\nListed the directory.",
  "cwd": "/workspace/demo",
  "included_roles": [
    "assistant"
  ],
  "included_tool_calls": true,
  "message_count": 1,
  "messages_returned": 1,
  "session_id": "session-codex-tool-fixture",
  "source": "session-codex-tool-fixture.jsonl",
  "timestamp": "__TS__",
  "warnings": []
}
