{
  "chorus_output_version": 1,
  "agent": "codex",
  "source": "/home/user/agent-chorus/fixtures/session-store/codex/sessions/2026/01/01/session-codex-fixture-0001.jsonl",
  "content": "Codex fixture assistant output.",
  "warnings": [],
  "session_id": "session-codex-fixture-0001",
  "cwd": "/workspace/demo",
  "timestamp": "2026-03-17T15:54:38.575Z",
  "message_count": 1,
  "messages_returned": 1
}
