{
  "agent": "cursor",
  "chorus_output_version": 1,
  "content": "Checking the file.\n[TOOL: Read]\n{\n  \"path\": \"/workspace/demo/README.md\"\n}\n[/TOOL]\nDone reading.",
  "cwd": "/workspace/demo",
  "included_roles": [
    "assistant"
  ],
  "included_tool_calls": true,
  "message_count": 1,
  "messages_returned": 1,
  "session_id": "session-cursor-tool-calls",
  "source": "session-cursor-tool-calls.jsonl",
  "timestamp": "__TS__",
  "warnings": []
}
